{
  "schema_version": "0.1",
  "task_id": "demo:watch_task_0",
  "campaign_id": "fictional_demonstration",
  "expected_state_version": 0,
  "kind": "autonomous",
  "actor_ids": [
    "faction"
  ],
  "context_file": "examples/context_faction_0.json",
  "goal": "Watch the gates while the player reads.",
  "not_before_world_minute": 1,
  "conditions": [
    {
      "path": "/positions/player",
      "equals": "town_gate"
    }
  ],
  "status": "prepared",
  "budget": {
    "max_model_calls": 1,
    "max_seconds": 15
  },
  "cancel_on_player_input": true
}
